Authors,Author(s) ID,Title,Year,Source title,Volume,Issue,Art. No.,Page start,Page end,Page count,Cited by,DOI,Link,Affiliations,Authors with affiliations,Document Type,Publication Stage,Open Access,Source,EID
"Abrego L., Gordleeva S., Kanakov O., Krivonosov M., Zaikin A.","57194695980;55328272900;8958614400;57200324455;7103103296;","Estimating integrated information in bidirectional neuron-astrocyte communication",2021,"Physical Review E","103","2","022410","","",,4,"10.1103/PhysRevE.103.022410","https://www.scopus.com/inward/record.uri?eid=2-s2.0-85102400547&doi=10.1103%2fPhysRevE.103.022410&partnerID=40&md5=e62917fcc9003b30c077e49ae5278d51","Department of Mathematics, University College London, London, United Kingdom; Neuroscience and Cognitive Technology Laboratory, Center for Technologies in Robotics and Mechatronics Components, Innopolis University, Innopolis, Russian Federation; Lobachevsky State University of Nizhny Novgorod, Nizhny Novgorod, Russian Federation; Institute for Women's Health, University College London, London, WC1E 6BT, United Kingdom; Centre for Analysis of Complex Systems, Sechenov First Moscow State Medical University (Sechenov University), Moscow, Russian Federation","Abrego, L., Department of Mathematics, University College London, London, United Kingdom; Gordleeva, S., Neuroscience and Cognitive Technology Laboratory, Center for Technologies in Robotics and Mechatronics Components, Innopolis University, Innopolis, Russian Federation, Lobachevsky State University of Nizhny Novgorod, Nizhny Novgorod, Russian Federation; Kanakov, O., Lobachevsky State University of Nizhny Novgorod, Nizhny Novgorod, Russian Federation; Krivonosov, M., Lobachevsky State University of Nizhny Novgorod, Nizhny Novgorod, Russian Federation; Zaikin, A., Department of Mathematics, University College London, London, United Kingdom, Lobachevsky State University of Nizhny Novgorod, Nizhny Novgorod, Russian Federation, Institute for Women's Health, University College London, London, WC1E 6BT, United Kingdom, Centre for Analysis of Complex Systems, Sechenov First Moscow State Medical University (Sechenov University), Moscow, Russian Federation",Article,"Final","All Open Access, Green",Scopus,2-s2.0-85102400547
"Karpov O.E., Grubov V.V., Maksimenko V.A., Utaschev N., Semerikov V.E., Andrikov D.A., Hramov A.E.","57222075641;54787609400;56572360300;57222064070;57222063701;57222061349;6603156741;","Noise amplification precedes extreme epileptic events on human EEG",2021,"Physical Review E","103","2","022310","","",,3,"10.1103/PhysRevE.103.022310","https://www.scopus.com/inward/record.uri?eid=2-s2.0-85101254907&doi=10.1103%2fPhysRevE.103.022310&partnerID=40&md5=1495bfddfe83fe909a904b98e673181c","National Medical and Surgical Center Named after N. I. Pirogov, Ministry of Healthcare of the Russian Federation, Moscow, 105203, Russian Federation; Research and Production Company Immersmed, Moscow, 105203, Russian Federation; Neuroscience and Cognitive Technology Laboratory, Center for Technologies in Robotics and Mechatronics Components, Innopolis University, Kazan, 420500, Russian Federation","Karpov, O.E., National Medical and Surgical Center Named after N. I. Pirogov, Ministry of Healthcare of the Russian Federation, Moscow, 105203, Russian Federation; Grubov, V.V., Research and Production Company Immersmed, Moscow, 105203, Russian Federation, Neuroscience and Cognitive Technology Laboratory, Center for Technologies in Robotics and Mechatronics Components, Innopolis University, Kazan, 420500, Russian Federation; Maksimenko, V.A., Research and Production Company Immersmed, Moscow, 105203, Russian Federation, Neuroscience and Cognitive Technology Laboratory, Center for Technologies in Robotics and Mechatronics Components, Innopolis University, Kazan, 420500, Russian Federation; Utaschev, N., National Medical and Surgical Center Named after N. I. Pirogov, Ministry of Healthcare of the Russian Federation, Moscow, 105203, Russian Federation; Semerikov, V.E., Research and Production Company Immersmed, Moscow, 105203, Russian Federation; Andrikov, D.A., Research and Production Company Immersmed, Moscow, 105203, Russian Federation; Hramov, A.E., Neuroscience and Cognitive Technology Laboratory, Center for Technologies in Robotics and Mechatronics Components, Innopolis University, Kazan, 420500, Russian Federation",Article,"Final","",Scopus,2-s2.0-85101254907
"Muchkaev V.Y., Senchurov V.A., Kurkin S., Badarin A.","35299988600;35173721000;35334432000;56359138000;","Electron Flow Modulation in Double-Gap Cavity with a Multiple Ratio of the Two Modes Frequencies",2021,"IEEE Transactions on Electron Devices","68","2","9321182","835","840",,1,"10.1109/TED.2020.3046994","https://www.scopus.com/inward/record.uri?eid=2-s2.0-85099597259&doi=10.1109%2fTED.2020.3046994&partnerID=40&md5=edae535c6592ae6b0ffb49ece1f60af5","Department of Electronic Devices and Equipment, Yuri Gagarin State Technical University of Saratov, Saratov, Russian Federation; Neuroscience and Cognitive Technology Lab, Center for Technologies in Robotics and Mechatronics Components, Innopolis University, Innopolis, Russian Federation","Muchkaev, V.Y., Department of Electronic Devices and Equipment, Yuri Gagarin State Technical University of Saratov, Saratov, Russian Federation; Senchurov, V.A., Department of Electronic Devices and Equipment, Yuri Gagarin State Technical University of Saratov, Saratov, Russian Federation; Kurkin, S., Neuroscience and Cognitive Technology Lab, Center for Technologies in Robotics and Mechatronics Components, Innopolis University, Innopolis, Russian Federation; Badarin, A., Neuroscience and Cognitive Technology Lab, Center for Technologies in Robotics and Mechatronics Components, Innopolis University, Innopolis, Russian Federation",Article,"Final","",Scopus,2-s2.0-85099597259
"Siddique A., Afanasyev I.","57215412664;57202156203;","Deep learning-based trajectory estimation of vehicles in crowded and crossroad scenarios",2021,"Conference of Open Innovation Association, FRUCT","2021-January",,"9347580","","",,2,"10.23919/FRUCT50888.2021.9347580","https://www.scopus.com/inward/record.uri?eid=2-s2.0-85101242286&doi=10.23919%2fFRUCT50888.2021.9347580&partnerID=40&md5=5006546712705788c9a91e3e571aaf5d","Innopolis University, Kazan, Russian Federation","Siddique, A., Innopolis University, Kazan, Russian Federation; Afanasyev, I., Innopolis University, Kazan, Russian Federation",Conference Paper,"Final","",Scopus,2-s2.0-85101242286
"Zhao W., Pashkevich A., Klimchik A., Chablat D.","57191922086;6701582655;37016245900;6602989627;","Kinematic Control of Compliant Serial Manipulators Composed of Dual-Triangles",2021,"2021 International Conference on Computer, Control and Robotics, ICCCR 2021",,,"9349285","93","97",,2,"10.1109/ICCCR49711.2021.9349285","https://www.scopus.com/inward/record.uri?eid=2-s2.0-85101708168&doi=10.1109%2fICCCR49711.2021.9349285&partnerID=40&md5=d67ea94d84f38ad7c014ad933451462f","Ecole Centrale Nantes, Laboratoire des Sciences du Numerique de Nantes, Nantes, France; Imt Atlantique Nantes, Laboratoire des Sciences du Numerique de Nantes, Nantes, France; Innopolis University, Tatarstan, Russian Federation; Centre National de la Recherche Scientifique (CNRS), Laboratoire des Sciences du Numerique de Nantes, Nantes, France","Zhao, W., Ecole Centrale Nantes, Laboratoire des Sciences du Numerique de Nantes, Nantes, France; Pashkevich, A., Imt Atlantique Nantes, Laboratoire des Sciences du Numerique de Nantes, Nantes, France; Klimchik, A., Innopolis University, Tatarstan, Russian Federation; Chablat, D., Centre National de la Recherche Scientifique (CNRS), Laboratoire des Sciences du Numerique de Nantes, Nantes, France",Conference Paper,"Final","All Open Access, Green",Scopus,2-s2.0-85101708168
"Kazmi S.M.A., Otoum S., Hussain R., Mouftah H.T.","56783838600;55868260900;35324500900;7102957682;","A Novel Deep Reinforcement Learning-based Approach for Task-offloading in Vehicular Networks",2021,"2021 IEEE Global Communications Conference, GLOBECOM 2021 - Proceedings",,,,"","",,,"10.1109/GLOBECOM46510.2021.9685073","https://www.scopus.com/inward/record.uri?eid=2-s2.0-85127229490&doi=10.1109%2fGLOBECOM46510.2021.9685073&partnerID=40&md5=283fe8e4dd622e50a11340c55ca7c11f","Innopolis University, Networks and Blockchain Lab, Innopolis, Russian Federation; College of Technological Innovation (CTI), Zayed University, United Arab Emirates; University of Ottawa, Department of Electrical Engineering and Computer Science, Canada","Kazmi, S.M.A., Innopolis University, Networks and Blockchain Lab, Innopolis, Russian Federation; Otoum, S., College of Technological Innovation (CTI), Zayed University, United Arab Emirates; Hussain, R., Innopolis University, Networks and Blockchain Lab, Innopolis, Russian Federation; Mouftah, H.T., University of Ottawa, Department of Electrical Engineering and Computer Science, Canada",Conference Paper,"Final","",Scopus,2-s2.0-85127229490
"Grubov V., Badarin A., Savosenkov A., Grigoriev N., Lukojanov M., Ydoratina A., Maximenko V., Kazantsev V.B., Hramov A.E.","54787609400;56359138000;57202748368;57491279800;57491703200;57490995600;57195473458;7005605401;6603156741;","Efficiency and fatigue in marksmanship training",2021,"Conference Proceedings - 5th Scientific School Dynamics of Complex Networks and their Applications, DCNA 2021",,,,"77","80",,,"10.1109/DCNA53427.2021.9587150","https://www.scopus.com/inward/record.uri?eid=2-s2.0-85126561432&doi=10.1109%2fDCNA53427.2021.9587150&partnerID=40&md5=acfa62b50e4e85850cd31f9494ea0f18","Neuroscience and Cognitive Technology Lab, Center for Technologies in Robotics and Mechatronics Components, Innopolis University, Innopolis, Russian Federation; Brain-Machine Interface Development Lab, Institute for Neurosciences, Lobachevskiy University, Nijnij Novgorod, Russian Federation","Grubov, V., Neuroscience and Cognitive Technology Lab, Center for Technologies in Robotics and Mechatronics Components, Innopolis University, Innopolis, Russian Federation; Badarin, A., Neuroscience and Cognitive Technology Lab, Center for Technologies in Robotics and Mechatronics Components, Innopolis University, Innopolis, Russian Federation; Savosenkov, A., Brain-Machine Interface Development Lab, Institute for Neurosciences, Lobachevskiy University, Nijnij Novgorod, Russian Federation; Grigoriev, N., Brain-Machine Interface Development Lab, Institute for Neurosciences, Lobachevskiy University, Nijnij Novgorod, Russian Federation; Lukojanov, M., Brain-Machine Interface Development Lab, Institute for Neurosciences, Lobachevskiy University, Nijnij Novgorod, Russian Federation; Ydoratina, A., Brain-Machine Interface Development Lab, Institute for Neurosciences, Lobachevskiy University, Nijnij Novgorod, Russian Federation; Maximenko, V., Neuroscience and Cognitive Technology Lab, Center for Technologies in Robotics and Mechatronics Components, Innopolis University, Innopolis, Russian Federation; Kazantsev, V.B., Neuroscience and Cognitive Technology Lab, Center for Technologies in Robotics and Mechatronics Components, Innopolis University, Innopolis, Russian Federation; Hramov, A.E., Neuroscience and Cognitive Technology Lab, Center for Technologies in Robotics and Mechatronics Components, Innopolis University, Innopolis, Russian Federation",Conference Paper,"Final","",Scopus,2-s2.0-85126561432
"Rozhnova M.A., Kazantsev V.B., Pankratova E.V.","57211160424;7005605401;7004661122;","Bistable Dynamics of the Brain Extracellular Matrix in the Presence of Periodically Varying Neuronal Activity",2021,"Conference Proceedings - 5th Scientific School Dynamics of Complex Networks and their Applications, DCNA 2021",,,,"162","164",,,"10.1109/DCNA53427.2021.9586855","https://www.scopus.com/inward/record.uri?eid=2-s2.0-85126558113&doi=10.1109%2fDCNA53427.2021.9586855&partnerID=40&md5=ccce02004de21ba7caa29f478130239a","Department of Applied Mathematics, Institute of Information Technologies, Mathematics and Mechanics, Lobachevsky State University of Nizhni Novgorod, Nizhny Novgorod, Russian Federation; Neurotechnology Department, Lobachevsky State University, Nizhny Novgorod, Russian Federation; Neuroscience and Cognitive Technology Laboratory, Center for Technologies in Robotics and Mechatronics Components, Innopolis University, Innopolis, Russian Federation; Neuroscience Research Institute, Samara State Medical University, Samara, Russian Federation; Center for Neurotechnology and Machine Learning, Immanuel Kant Baltic Federal University, Kaliningrad, Russian Federation","Rozhnova, M.A., Department of Applied Mathematics, Institute of Information Technologies, Mathematics and Mechanics, Lobachevsky State University of Nizhni Novgorod, Nizhny Novgorod, Russian Federation; Kazantsev, V.B., Neurotechnology Department, Lobachevsky State University, Nizhny Novgorod, Russian Federation, Neuroscience and Cognitive Technology Laboratory, Center for Technologies in Robotics and Mechatronics Components, Innopolis University, Innopolis, Russian Federation, Neuroscience Research Institute, Samara State Medical University, Samara, Russian Federation, Center for Neurotechnology and Machine Learning, Immanuel Kant Baltic Federal University, Kaliningrad, Russian Federation; Pankratova, E.V., Department of Applied Mathematics, Institute of Information Technologies, Mathematics and Mechanics, Lobachevsky State University of Nizhni Novgorod, Nizhny Novgorod, Russian Federation",Conference Paper,"Final","",Scopus,2-s2.0-85126558113
"Khorev V., Kazantsev V.B.","55241932000;7005605401;","Factor of border crossing limitation with an infection hub in the SIR covid model",2021,"Conference Proceedings - 5th Scientific School Dynamics of Complex Networks and their Applications, DCNA 2021",,,,"95","96",,,"10.1109/DCNA53427.2021.9586890","https://www.scopus.com/inward/record.uri?eid=2-s2.0-85126556051&doi=10.1109%2fDCNA53427.2021.9586890&partnerID=40&md5=625895e6e8efd3c4dbb7859ba163d81c","Center for technologies in robotics and mechatronics components, Innopolis University, Innopolis, Russian Federation; Neurotechnology deparment, Lobachevsky University, Nizhniy Novgorod, Russian Federation; Center for Neurotechnology and Machine Learning, Immanuel Kant Baltic Federal University, Kaliningrad, Russian Federation","Khorev, V., Center for technologies in robotics and mechatronics components, Innopolis University, Innopolis, Russian Federation; Kazantsev, V.B., Center for technologies in robotics and mechatronics components, Innopolis University, Innopolis, Russian Federation, Neurotechnology deparment, Lobachevsky University, Nizhniy Novgorod, Russian Federation, Center for Neurotechnology and Machine Learning, Immanuel Kant Baltic Federal University, Kaliningrad, Russian Federation",Conference Paper,"Final","",Scopus,2-s2.0-85126556051
"Kuc A., Grubov V.","57205658369;54787609400;","Analysis of behavioral characteristics during prolonged cognitive load",2021,"Conference Proceedings - 5th Scientific School Dynamics of Complex Networks and their Applications, DCNA 2021",,,,"119","121",,,"10.1109/DCNA53427.2021.9587326","https://www.scopus.com/inward/record.uri?eid=2-s2.0-85126555825&doi=10.1109%2fDCNA53427.2021.9587326&partnerID=40&md5=c1f03fbae8e2865a3ecd6661743870c8","Neuroscience and Cognitive Technology Laboratory, Center for Technologies in Robotics and Mechatronics Components, Innopolis University, Innopolis, Russian Federation; Center for Neurotechnology and Machine Learning, Immanuel Kant Baltic Federal University, Kaliningrad, Russian Federation; Center of New Cardiological Informational Technologies, Scientific Research Institute of Cardiology, Saratov State Medical University, Saratov, Russian Federation","Kuc, A., Neuroscience and Cognitive Technology Laboratory, Center for Technologies in Robotics and Mechatronics Components, Innopolis University, Innopolis, Russian Federation, Center for Neurotechnology and Machine Learning, Immanuel Kant Baltic Federal University, Kaliningrad, Russian Federation; Grubov, V., Center for Neurotechnology and Machine Learning, Immanuel Kant Baltic Federal University, Kaliningrad, Russian Federation, Center of New Cardiological Informational Technologies, Scientific Research Institute of Cardiology, Saratov State Medical University, Saratov, Russian Federation",Conference Paper,"Final","",Scopus,2-s2.0-85126555825
"Khorev V.","55241932000;","Effect of the fatigue in the balance keeping experiment",2021,"Conference Proceedings - 5th Scientific School Dynamics of Complex Networks and their Applications, DCNA 2021",,,,"97","98",,,"10.1109/DCNA53427.2021.9587315","https://www.scopus.com/inward/record.uri?eid=2-s2.0-85126554331&doi=10.1109%2fDCNA53427.2021.9587315&partnerID=40&md5=1a695925f8f4292750d755d361538f45","Center for Technologies in Robotics and Mechatronics Components, Innopolis University, Innopolis, Russian Federation","Khorev, V., Center for Technologies in Robotics and Mechatronics Components, Innopolis University, Innopolis, Russian Federation",Conference Paper,"Final","",Scopus,2-s2.0-85126554331
"Frolov N., Ghosh D.","16498801300;56225913500;","Mixing adaptive rules in a bilayer Erdős-Rényi network",2021,"Conference Proceedings - 5th Scientific School Dynamics of Complex Networks and their Applications, DCNA 2021",,,,"75","76",,,"10.1109/DCNA53427.2021.9587298","https://www.scopus.com/inward/record.uri?eid=2-s2.0-85126549668&doi=10.1109%2fDCNA53427.2021.9587298&partnerID=40&md5=41916133d5629f8de548eb15de17b72f","Innopolis University, Innopolis, Russian Federation; Immanuel Kant Baltic Federal University, Kaliningrad, Russian Federation; Indian Statistical Institute, Kolkata, India","Frolov, N., Innopolis University, Innopolis, Russian Federation, Immanuel Kant Baltic Federal University, Kaliningrad, Russian Federation; Ghosh, D., Indian Statistical Institute, Kolkata, India",Conference Paper,"Final","",Scopus,2-s2.0-85126549668
"Makovkin S., Gordleeva S., Ivanchenko M.","57189508849;55328272900;6603861723;","Synchronization in two topologies in the neuron-astrocyte network",2021,"Conference Proceedings - 5th Scientific School Dynamics of Complex Networks and their Applications, DCNA 2021",,,,"133","134",,,"10.1109/DCNA53427.2021.9587094","https://www.scopus.com/inward/record.uri?eid=2-s2.0-85126541787&doi=10.1109%2fDCNA53427.2021.9587094&partnerID=40&md5=25f499e3d9dcf9bb6442d921faa13aef","Lobachevsky University, Nizhny Novgorod, Russian Federation; Lobachevsky University Nizhny Novgorod, Russia Innopolis University, Innopolis, Russian Federation; Centerfor Neurotechnology and Machine Learning, Immanuel Kant Baltic Federal University, Kaliningrad, Russian Federation","Makovkin, S., Lobachevsky University, Nizhny Novgorod, Russian Federation; Gordleeva, S., Lobachevsky University Nizhny Novgorod, Russia Innopolis University, Innopolis, Russian Federation, Centerfor Neurotechnology and Machine Learning, Immanuel Kant Baltic Federal University, Kaliningrad, Russian Federation; Ivanchenko, M., Lobachevsky University, Nizhny Novgorod, Russian Federation",Conference Paper,"Final","",Scopus,2-s2.0-85126541787
"Kuc A.","57205658369;","Effect of prehistory on the ambiguous stimuli processing in the human brain",2021,"Conference Proceedings - 5th Scientific School Dynamics of Complex Networks and their Applications, DCNA 2021",,,,"116","118",,,"10.1109/DCNA53427.2021.9586879","https://www.scopus.com/inward/record.uri?eid=2-s2.0-85126540874&doi=10.1109%2fDCNA53427.2021.9586879&partnerID=40&md5=28c4db14d24e937e65ae9e320dc5a612","Neuroscience and Cognitive Technology Lab, Center for Technologies in Robotics and Mechatronics Components, Innopolis University, Innopolis, Russian Federation; Center for Neurotechnology and Machine Learning, Immanuel Kant Baltic Federal University, Kaliningrad, Russian Federation","Kuc, A., Neuroscience and Cognitive Technology Lab, Center for Technologies in Robotics and Mechatronics Components, Innopolis University, Innopolis, Russian Federation, Center for Neurotechnology and Machine Learning, Immanuel Kant Baltic Federal University, Kaliningrad, Russian Federation",Conference Paper,"Final","",Scopus,2-s2.0-85126540874
"Pitsik E., Frolov N.","57192586726;16498801300;","Recurrence quantification analysis detects P300 on single-trial EEG",2021,"Conference Proceedings - 5th Scientific School Dynamics of Complex Networks and their Applications, DCNA 2021",,,,"155","158",,,"10.1109/DCNA53427.2021.9586886","https://www.scopus.com/inward/record.uri?eid=2-s2.0-85126539555&doi=10.1109%2fDCNA53427.2021.9586886&partnerID=40&md5=205b7fb13727c34753c122edafb26aa6","Neuroscience and cognitive technology laboratory, Innopolis University, Innopolis, Russian Federation; Center for Neurotechnology and Machine Learning, Immanuel Kant Baltic Federal University, Kaliningrad, Russian Federation","Pitsik, E., Neuroscience and cognitive technology laboratory, Innopolis University, Innopolis, Russian Federation, Center for Neurotechnology and Machine Learning, Immanuel Kant Baltic Federal University, Kaliningrad, Russian Federation; Frolov, N., Neuroscience and cognitive technology laboratory, Innopolis University, Innopolis, Russian Federation, Center for Neurotechnology and Machine Learning, Immanuel Kant Baltic Federal University, Kaliningrad, Russian Federation",Conference Paper,"Final","",Scopus,2-s2.0-85126539555
"Antipov V.","57212195512;","Customizable and Flexible Pressure Sensor Matrix",2021,"Conference Proceedings - 5th Scientific School Dynamics of Complex Networks and their Applications, DCNA 2021",,,,"25","28",,,"10.1109/DCNA53427.2021.9586833","https://www.scopus.com/inward/record.uri?eid=2-s2.0-85126534944&doi=10.1109%2fDCNA53427.2021.9586833&partnerID=40&md5=edd5a8e7614d91d045fa5202c1e6e41e","Neuroscience and Cognitive Technology Laboratory, Center for Technologies in Robotics and Mechatronics Components, Innopolis University, Innopolis, Russian Federation; Lobachevsky University, Nizhny Novgorod, Russian Federation","Antipov, V., Neuroscience and Cognitive Technology Laboratory, Center for Technologies in Robotics and Mechatronics Components, Innopolis University, Innopolis, Russian Federation, Lobachevsky University, Nizhny Novgorod, Russian Federation",Conference Paper,"Final","",Scopus,2-s2.0-85126534944
"Makarov V., Grubov V., Kurkin S., Smirnov N.","56459531300;54787609400;35334432000;57219972477;","Source-level analysis of brain activity in the process of learning and retrieving new information",2021,"Conference Proceedings - 5th Scientific School Dynamics of Complex Networks and their Applications, DCNA 2021",,,,"129","132",,,"10.1109/DCNA53427.2021.9587008","https://www.scopus.com/inward/record.uri?eid=2-s2.0-85126533916&doi=10.1109%2fDCNA53427.2021.9587008&partnerID=40&md5=ad66bef715edc6ca42d03928c89cb200","Neuroscience and Cognitive Technology Laboratory, Center for Technologies in Robotics and Mechatronics Components, Innopolis University, Innopolis, Russian Federation; Center for Neurotechnology and Machine Learning, Immanuel Kant Baltic Federal University, Kaliningrad, Russian Federation","Makarov, V., Neuroscience and Cognitive Technology Laboratory, Center for Technologies in Robotics and Mechatronics Components, Innopolis University, Innopolis, Russian Federation; Grubov, V., Center for Neurotechnology and Machine Learning, Immanuel Kant Baltic Federal University, Kaliningrad, Russian Federation; Kurkin, S., Center for Neurotechnology and Machine Learning, Immanuel Kant Baltic Federal University, Kaliningrad, Russian Federation; Smirnov, N., Neuroscience and Cognitive Technology Laboratory, Center for Technologies in Robotics and Mechatronics Components, Innopolis University, Innopolis, Russian Federation",Conference Paper,"Final","",Scopus,2-s2.0-85126533916
"Pisarchik A.N.","7005864666;","Coherence Resonance in Complex Networks",2021,"Conference Proceedings - 5th Scientific School Dynamics of Complex Networks and their Applications, DCNA 2021",,,,"151","154",,,"10.1109/DCNA53427.2021.9587095","https://www.scopus.com/inward/record.uri?eid=2-s2.0-85126533760&doi=10.1109%2fDCNA53427.2021.9587095&partnerID=40&md5=eea6bbe1beb53b53ddcd4848ad80e0a3","Center for Biomedical Technology, Universidad Politécnica de Madrid, Madrid, Spain; Innopolis University, Innopolis, Russian Federation","Pisarchik, A.N., Center for Biomedical Technology, Universidad Politécnica de Madrid, Madrid, Spain, Innopolis University, Innopolis, Russian Federation",Conference Paper,"Final","",Scopus,2-s2.0-85126533760
"Bahrami M.R.","57197731584;","Initial and Boundary Conditions Effects on the Motion of Moving Object on the Electrical Transmission Line",2021,"Conference Proceedings - 5th Scientific School Dynamics of Complex Networks and their Applications, DCNA 2021",,,,"40","43",,,"10.1109/DCNA53427.2021.9587314","https://www.scopus.com/inward/record.uri?eid=2-s2.0-85126524921&doi=10.1109%2fDCNA53427.2021.9587314&partnerID=40&md5=3b561621bfd248b37663a4ac394ec67f","Institute of information security and cyber-physical systems, Innopolis university, Innopolis, Russian Federation","Bahrami, M.R., Institute of information security and cyber-physical systems, Innopolis university, Innopolis, Russian Federation",Conference Paper,"Final","",Scopus,2-s2.0-85126524921
