Authors,Author(s) ID,Title,Year,Source title,Volume,Issue,Art. No.,Page start,Page end,Page count,Cited by,DOI,Link,Affiliations,Authors with affiliations,Document Type,Publication Stage,Open Access,Source,EID
"Ayodele K.P., Jimoh H., Fagbamigbe A.F., Onakpoya O.H.","25654510000;57412405000;50861113000;22136150900;","The dynamics of COVID-19 outbreak in Nigeria: A sub-national analysis",2021,"Scientific African","13",,"e00914","","",,,"10.1016/j.sciaf.2021.e00914","https://www.scopus.com/inward/record.uri?eid=2-s2.0-85122828199&doi=10.1016%2fj.sciaf.2021.e00914&partnerID=40&md5=2589b9ac71dd5770ff8f44b28badb7c8","Department of Electronic, and Electrical Engineering, Obafemi Awolowo University, Nigeria; Intelligent Robotic Systems Laboratory, Innopolis University, Innopolis City, Russian Federation; Department of Epidemiology and Medical Statistics, University of Ibadan, Nigeria; Department of Medicine, Obafemi Awolowo University, Nigeria","Ayodele, K.P., Department of Electronic, and Electrical Engineering, Obafemi Awolowo University, Nigeria; Jimoh, H., Intelligent Robotic Systems Laboratory, Innopolis University, Innopolis City, Russian Federation; Fagbamigbe, A.F., Department of Epidemiology and Medical Statistics, University of Ibadan, Nigeria; Onakpoya, O.H., Department of Medicine, Obafemi Awolowo University, Nigeria",Article,"Final","All Open Access, Gold, Green",Scopus,2-s2.0-85122828199
"Ismaeel K., Naumchev A., Sadovykh A., Truscan D., Enoiu E.P., Seceleanu C.","57322198800;57190306849;24479058100;6508330976;36462407100;55884138900;","Security Requirements as Code: Example from VeriDevOps Project",2021,"Proceedings of the IEEE International Conference on Requirements Engineering","2021-September",,,"357","363",,,"10.1109/REW53955.2021.00063","https://www.scopus.com/inward/record.uri?eid=2-s2.0-85118455050&doi=10.1109%2fREW53955.2021.00063&partnerID=40&md5=7e4b064f4892afe07506ef330e3321b8","Innopolis University, Innopolis, Russian Federation; Schaffhausen Institute of Technology, Schaffhausen, Switzerland; Innopolis University and Softeam, Innopolis Russia, Paris, France; Åbo Akademi University, Turku, Finland; Mälardalen University, Västeras, Sweden","Ismaeel, K., Innopolis University, Innopolis, Russian Federation; Naumchev, A., Schaffhausen Institute of Technology, Schaffhausen, Switzerland; Sadovykh, A., Innopolis University and Softeam, Innopolis Russia, Paris, France; Truscan, D., Åbo Akademi University, Turku, Finland; Enoiu, E.P., Mälardalen University, Västeras, Sweden; Seceleanu, C., Mälardalen University, Västeras, Sweden",Conference Paper,"Final","",Scopus,2-s2.0-85118455050
"Ebersold S., Laleau R., Mazzara M.","25640661100;57203847210;8557895400;","Welcome from the Organizers FormReq 2021",2021,"Proceedings of the IEEE International Conference on Requirements Engineering","2021-September",,,"349","",,,"10.1109/REW53955.2021.00061","https://www.scopus.com/inward/record.uri?eid=2-s2.0-85118440094&doi=10.1109%2fREW53955.2021.00061&partnerID=40&md5=475dedd3a35ecfd73c0e85214d369806","University of Toulouse, France; University of Paris-Est Créteil, France; Russia Innopolis University, Russian Federation","Ebersold, S., University of Toulouse, France; Laleau, R., University of Paris-Est Créteil, France; Mazzara, M., Russia Innopolis University, Russian Federation",Editorial,"Final","",Scopus,2-s2.0-85118440094
"Briskin E.S., Kalinin Y.V., Lepetukhin K.Y., Maloletov A.V., Sharonov N.G.","6506125834;44161114000;57211559614;35364441900;56263638700;","On Controlling the Shape of a Circular Sprinkling Machine and the Stability of Its Programmed Motion",2021,"Journal of Computer and Systems Sciences International","60","5",,"817","826",,,"10.1134/S1064230721050063","https://www.scopus.com/inward/record.uri?eid=2-s2.0-85117300792&doi=10.1134%2fS1064230721050063&partnerID=40&md5=21272fc4f0d4a8a37e6a9f9911eb5a69","Volgograd State Technical University, Volgograd, Russian Federation; Center for Technologies of Robotics and Mechatronics Components, Innopolis University, Innopolis, Russian Federation","Briskin, E.S., Volgograd State Technical University, Volgograd, Russian Federation, Center for Technologies of Robotics and Mechatronics Components, Innopolis University, Innopolis, Russian Federation; Kalinin, Y.V., Volgograd State Technical University, Volgograd, Russian Federation, Center for Technologies of Robotics and Mechatronics Components, Innopolis University, Innopolis, Russian Federation; Lepetukhin, K.Y., Volgograd State Technical University, Volgograd, Russian Federation; Maloletov, A.V., Volgograd State Technical University, Volgograd, Russian Federation, Center for Technologies of Robotics and Mechatronics Components, Innopolis University, Innopolis, Russian Federation; Sharonov, N.G., Volgograd State Technical University, Volgograd, Russian Federation, Center for Technologies of Robotics and Mechatronics Components, Innopolis University, Innopolis, Russian Federation",Article,"Final","",Scopus,2-s2.0-85117300792
"Savin S., Balakhnov O., Khusainov R., Klimchik A.","55978984900;57211524628;56895904700;37016245900;","State observer for linear systems with explicit constraints: Orthogonal decomposition method",2021,"Sensors","21","18","6312","","",,,"10.3390/s21186312","https://www.scopus.com/inward/record.uri?eid=2-s2.0-85115171920&doi=10.3390%2fs21186312&partnerID=40&md5=3a184ddcf75828b2d0abb511e4031269","Center for Technologies in Robotics and Mechatronics Components, Innopolis University, Innopolis, 420500, Russian Federation","Savin, S., Center for Technologies in Robotics and Mechatronics Components, Innopolis University, Innopolis, 420500, Russian Federation; Balakhnov, O., Center for Technologies in Robotics and Mechatronics Components, Innopolis University, Innopolis, 420500, Russian Federation; Khusainov, R., Center for Technologies in Robotics and Mechatronics Components, Innopolis University, Innopolis, 420500, Russian Federation; Klimchik, A., Center for Technologies in Robotics and Mechatronics Components, Innopolis University, Innopolis, 420500, Russian Federation",Article,"Final","All Open Access, Gold, Green",Scopus,2-s2.0-85115171920
"Anwar M.S., Ghosh D., Frolov N.","57220155747;56225913500;16498801300;","Relay synchronization in a weighted triplex network",2021,"Mathematics","9","17","2135","","",,1,"10.3390/math9172135","https://www.scopus.com/inward/record.uri?eid=2-s2.0-85114650245&doi=10.3390%2fmath9172135&partnerID=40&md5=26e6dfc4077fc1a2c1a0092d5c5789b3","Physics and Applied Mathematics Unit, Indian Statistical Institute, 203 B. T. Road, Kolkata, 700108, India; Neuroscience and Cognitive Technology Laboratory, Center for Technologies in Robotics and Mechatronics Components, Innopolis University, Innopolis, 420500, Russian Federation; Center for Neurotechnology and Machine Learning, Immanuel Kant Baltic Federal University, Kaliningrad, 236041, Russian Federation","Anwar, M.S., Physics and Applied Mathematics Unit, Indian Statistical Institute, 203 B. T. Road, Kolkata, 700108, India; Ghosh, D., Physics and Applied Mathematics Unit, Indian Statistical Institute, 203 B. T. Road, Kolkata, 700108, India; Frolov, N., Neuroscience and Cognitive Technology Laboratory, Center for Technologies in Robotics and Mechatronics Components, Innopolis University, Innopolis, 420500, Russian Federation, Center for Neurotechnology and Machine Learning, Immanuel Kant Baltic Federal University, Kaliningrad, 236041, Russian Federation",Article,"Final","All Open Access, Gold",Scopus,2-s2.0-85114650245
"Khramova M.V., Kuc A.K., Maksimenko V.A., Frolov N.S., Grubov V.V., Kurkin S.A., Pisarchik A.N., Shusharina N.N., Fedorov A.A., Hramov A.E.","56572729200;57205658369;56572360300;16498801300;54787609400;35334432000;7005864666;55790267200;57194903126;6603156741;","Monitoring the cortical activity of children and adults during cognitive task completion",2021,"Sensors","21","18","6021","","",,,"10.3390/s21186021","https://www.scopus.com/inward/record.uri?eid=2-s2.0-85114320286&doi=10.3390%2fs21186021&partnerID=40&md5=842d98c9ae60696b17facc5debe16381","Baltic Center for Artificial Intelligence and Neurotechnology, Immanuel Kant Baltic Federal University, Kaliningrad, 236041, Russian Federation; Faculty of Computer Science and Information Technology, Saratov State University, Saratov, 410012, Russian Federation; Neuroscience and Cognitive Technology Laboratory, Innopolis University, Kazan, 420500, Russian Federation; Centro de Tecnología Biomédica, Universidad Politécnica de Madrid, Madrid, 28223, Spain; Immanuel Kant Baltic Federal University, Kaliningrad, 236041, Russian Federation; Department of Theoretical Cybernetics, Saint Petersburg State University, St. Petersburg, 199034, Russian Federation","Khramova, M.V., Baltic Center for Artificial Intelligence and Neurotechnology, Immanuel Kant Baltic Federal University, Kaliningrad, 236041, Russian Federation, Faculty of Computer Science and Information Technology, Saratov State University, Saratov, 410012, Russian Federation; Kuc, A.K., Baltic Center for Artificial Intelligence and Neurotechnology, Immanuel Kant Baltic Federal University, Kaliningrad, 236041, Russian Federation; Maksimenko, V.A., Baltic Center for Artificial Intelligence and Neurotechnology, Immanuel Kant Baltic Federal University, Kaliningrad, 236041, Russian Federation, Neuroscience and Cognitive Technology Laboratory, Innopolis University, Kazan, 420500, Russian Federation; Frolov, N.S., Baltic Center for Artificial Intelligence and Neurotechnology, Immanuel Kant Baltic Federal University, Kaliningrad, 236041, Russian Federation, Neuroscience and Cognitive Technology Laboratory, Innopolis University, Kazan, 420500, Russian Federation; Grubov, V.V., Baltic Center for Artificial Intelligence and Neurotechnology, Immanuel Kant Baltic Federal University, Kaliningrad, 236041, Russian Federation, Neuroscience and Cognitive Technology Laboratory, Innopolis University, Kazan, 420500, Russian Federation; Kurkin, S.A., Baltic Center for Artificial Intelligence and Neurotechnology, Immanuel Kant Baltic Federal University, Kaliningrad, 236041, Russian Federation, Neuroscience and Cognitive Technology Laboratory, Innopolis University, Kazan, 420500, Russian Federation; Pisarchik, A.N., Baltic Center for Artificial Intelligence and Neurotechnology, Immanuel Kant Baltic Federal University, Kaliningrad, 236041, Russian Federation, Neuroscience and Cognitive Technology Laboratory, Innopolis University, Kazan, 420500, Russian Federation, Centro de Tecnología Biomédica, Universidad Politécnica de Madrid, Madrid, 28223, Spain; Shusharina, N.N., Baltic Center for Artificial Intelligence and Neurotechnology, Immanuel Kant Baltic Federal University, Kaliningrad, 236041, Russian Federation; Fedorov, A.A., Immanuel Kant Baltic Federal University, Kaliningrad, 236041, Russian Federation; Hramov, A.E., Baltic Center for Artificial Intelligence and Neurotechnology, Immanuel Kant Baltic Federal University, Kaliningrad, 236041, Russian Federation, Neuroscience and Cognitive Technology Laboratory, Innopolis University, Kazan, 420500, Russian Federation, Department of Theoretical Cybernetics, Saint Petersburg State University, St. Petersburg, 199034, Russian Federation",Article,"Final","All Open Access, Gold, Green",Scopus,2-s2.0-85114320286
"Mamedov S., Khusainov R., Gaponov I.","57205663201;56895904700;24922859900;","Piecewise Virtual Constraints for Trajectory Planning of Underactuated Mechanical Systems",2021,"IEEE International Conference on Automation Science and Engineering","2021-August",,,"928","933",,,"10.1109/CASE49439.2021.9551396","https://www.scopus.com/inward/record.uri?eid=2-s2.0-85117003593&doi=10.1109%2fCASE49439.2021.9551396&partnerID=40&md5=fa5a300261104ba3cc74f3393035a31c","Center for Technologies in Robotics and Mechatronics Components, Innopolis University, Innopolis, Russian Federation; Institute of Robotics and Computer Vision, Innopolis University, Innopolis, Russian Federation","Mamedov, S., Center for Technologies in Robotics and Mechatronics Components, Innopolis University, Innopolis, Russian Federation; Khusainov, R., Center for Technologies in Robotics and Mechatronics Components, Innopolis University, Innopolis, Russian Federation; Gaponov, I., Center for Technologies in Robotics and Mechatronics Components, Innopolis University, Innopolis, Russian Federation, Institute of Robotics and Computer Vision, Innopolis University, Innopolis, Russian Federation",Conference Paper,"Final","",Scopus,2-s2.0-85117003593
"Shcherba V., Hussain R.","57236549700;35324500900;","Blockchain and games: A novel middleware for blockchain-based multiplayer games",2021,"Proceedings of the 2021 SIGCOMM 2021 Poster and Demo Sessions, Part of SIGCOMM 2021",,,,"9","11",,,"10.1145/3472716.3472845","https://www.scopus.com/inward/record.uri?eid=2-s2.0-85113810809&doi=10.1145%2f3472716.3472845&partnerID=40&md5=b40e2d6c49ebb01a40c51e8cf71c5fc7","Innopolis University, Russian Federation","Shcherba, V., Innopolis University, Russian Federation; Hussain, R., Innopolis University, Russian Federation",Conference Paper,"Final","",Scopus,2-s2.0-85113810809
"Daniakin K.","57282618500;","Overcoming metric diversity in meta-analysis for software engineering: Proposed approach and a case study on its usage on the effects of software reuse",2021,"ESEC/FSE 2021 - Proceedings of the 29th ACM Joint Meeting European Software Engineering Conference and Symposium on the Foundations of Software Engineering",,,,"1677","1679",,,"10.1145/3468264.3473488","https://www.scopus.com/inward/record.uri?eid=2-s2.0-85116239569&doi=10.1145%2f3468264.3473488&partnerID=40&md5=31d1833e71f82ae5edc52ad6cafbe669","Innopolis University, Russian Federation","Daniakin, K., Innopolis University, Russian Federation",Conference Paper,"Final","",Scopus,2-s2.0-85116239569
"Kholodov Y., Alekseenko A., Kazorin V., Kurzhanskiy A.","6602420821;56734255800;57194039605;16025087200;","Generalization second order macroscopic traffic models via relative velocity of the congestion propagation",2021,"Mathematics","9","16","2001","","",,,"10.3390/math9162001","https://www.scopus.com/inward/record.uri?eid=2-s2.0-85113572834&doi=10.3390%2fmath9162001&partnerID=40&md5=5038bd2623fbc05607754596c80e1c7b","Division of Applied Mathematics, Moscow Institute of Physics and Technology, Innopolis University, Innopolis, 420500, Russian Federation; Institute for Computer Aided Design of RAS, Moscow, 123056, Russian Federation; Lab of Data Analysis and Bioinformatics, Innopolis University, Innopolis, 420500, Russian Federation; California Partners for Advanced Transportation Technology, University of California, Berkeley, Berkeley, CA  94720, United States","Kholodov, Y., Division of Applied Mathematics, Moscow Institute of Physics and Technology, Innopolis University, Innopolis, 420500, Russian Federation; Alekseenko, A., Institute for Computer Aided Design of RAS, Moscow, 123056, Russian Federation; Kazorin, V., Lab of Data Analysis and Bioinformatics, Innopolis University, Innopolis, 420500, Russian Federation; Kurzhanskiy, A., California Partners for Advanced Transportation Technology, University of California, Berkeley, Berkeley, CA  94720, United States",Article,"Final","All Open Access, Gold, Green",Scopus,2-s2.0-85113572834
"Gerasimova S.A., Belov A.I., Korolev D.S., Guseinov D.V., Lebedeva A.V., Koryazhkina M.N., Mikhaylov A.N., Kazantsev V.B., Pisarchik A.N.","56779844300;7202832059;57217519896;8929042600;56673830700;55977951100;6701888444;7005605401;7005864666;","Stochastic memristive interface for neural signal processing",2021,"Sensors","21","16","5587","","",,3,"10.3390/s21165587","https://www.scopus.com/inward/record.uri?eid=2-s2.0-85113152429&doi=10.3390%2fs21165587&partnerID=40&md5=3bb61fe2f13df9069e97704a384ab658","Institute of Biology and Biomedicine, National Research Lobachevsky State University of Nizhny Novgorod, Nizhny Novgorod, 603950, Russian Federation; Research Institute and Technology, National Research Lobachevsky State University of Nizhny Novgorod, Nizhny Novgorod, 603950, Russian Federation; Research and Educational Center “Physics of Solid State Nanostructures”, National Research Lobachevsky State University of Nizhny Novgorod, Nizhny Novgorod, 603950, Russian Federation; Laboratory of Neuroscience and Cognitive Technology, Innopolis University, Innopolis, 420500, Russian Federation; Center for Neurotechnology and Machine Learning, Immanuel Kant Baltic Federal University, Kaliningrad, 236016, Russian Federation; Center for Biomedical Technology, Universidad Politécnica de Madrid, Pozuelo de Alarcón, Madrid, 28223, Spain","Gerasimova, S.A., Institute of Biology and Biomedicine, National Research Lobachevsky State University of Nizhny Novgorod, Nizhny Novgorod, 603950, Russian Federation, Research Institute and Technology, National Research Lobachevsky State University of Nizhny Novgorod, Nizhny Novgorod, 603950, Russian Federation; Belov, A.I., Research Institute and Technology, National Research Lobachevsky State University of Nizhny Novgorod, Nizhny Novgorod, 603950, Russian Federation; Korolev, D.S., Research Institute and Technology, National Research Lobachevsky State University of Nizhny Novgorod, Nizhny Novgorod, 603950, Russian Federation; Guseinov, D.V., Research Institute and Technology, National Research Lobachevsky State University of Nizhny Novgorod, Nizhny Novgorod, 603950, Russian Federation; Lebedeva, A.V., Institute of Biology and Biomedicine, National Research Lobachevsky State University of Nizhny Novgorod, Nizhny Novgorod, 603950, Russian Federation; Koryazhkina, M.N., Research and Educational Center “Physics of Solid State Nanostructures”, National Research Lobachevsky State University of Nizhny Novgorod, Nizhny Novgorod, 603950, Russian Federation; Mikhaylov, A.N., Research Institute and Technology, National Research Lobachevsky State University of Nizhny Novgorod, Nizhny Novgorod, 603950, Russian Federation; Kazantsev, V.B., Institute of Biology and Biomedicine, National Research Lobachevsky State University of Nizhny Novgorod, Nizhny Novgorod, 603950, Russian Federation, Laboratory of Neuroscience and Cognitive Technology, Innopolis University, Innopolis, 420500, Russian Federation, Center for Neurotechnology and Machine Learning, Immanuel Kant Baltic Federal University, Kaliningrad, 236016, Russian Federation; Pisarchik, A.N., Research and Educational Center “Physics of Solid State Nanostructures”, National Research Lobachevsky State University of Nizhny Novgorod, Nizhny Novgorod, 603950, Russian Federation, Laboratory of Neuroscience and Cognitive Technology, Innopolis University, Innopolis, 420500, Russian Federation, Center for Biomedical Technology, Universidad Politécnica de Madrid, Pozuelo de Alarcón, Madrid, 28223, Spain",Article,"Final","All Open Access, Gold, Green",Scopus,2-s2.0-85113152429
"Suvorov V.A., Bahrami M.R., Akchurin E.E., Chukalkin I.A., Ermakov S.A., Kan S.A.","57214156053;57197731584;57225127827;57225126888;57225125898;57225127058;","Anti sway tuned control of gantry cranes",2021,"SN Applied Sciences","3","8","729","","",,,"10.1007/s42452-021-04719-w","https://www.scopus.com/inward/record.uri?eid=2-s2.0-85109210301&doi=10.1007%2fs42452-021-04719-w&partnerID=40&md5=6c5dd2c70543b37c0a8009b29b8c0240","Department of Mechanics and Control, Peter the Great St.Petersburg Polytechnic University, St.Petersburg, 195251, Russian Federation; Troitsk Crane Plant, Moscow, 108828, Russian Federation; Faculty of Computer Science and Engineering, Innopolis University, Innopolis, 420500, Russian Federation; Higher school of transport, Peter the Great St.Petersburg Polytechnic University, St.Petersburg, 195251, Russian Federation","Suvorov, V.A., Department of Mechanics and Control, Peter the Great St.Petersburg Polytechnic University, St.Petersburg, 195251, Russian Federation, Troitsk Crane Plant, Moscow, 108828, Russian Federation; Bahrami, M.R., Faculty of Computer Science and Engineering, Innopolis University, Innopolis, 420500, Russian Federation; Akchurin, E.E., Troitsk Crane Plant, Moscow, 108828, Russian Federation; Chukalkin, I.A., Troitsk Crane Plant, Moscow, 108828, Russian Federation; Ermakov, S.A., Troitsk Crane Plant, Moscow, 108828, Russian Federation, Higher school of transport, Peter the Great St.Petersburg Polytechnic University, St.Petersburg, 195251, Russian Federation; Kan, S.A., Troitsk Crane Plant, Moscow, 108828, Russian Federation",Article,"Final","All Open Access, Gold",Scopus,2-s2.0-85109210301
"Tsybina Y., Gordleeva S., Krivonosov M., Kastalskiy I., Zaikin A., Gorban A.","57219974710;55328272900;57200324455;55314345300;7103103296;7005285942;","Modelling working memory in neuron-astrocyte network",2021,"Proceedings of the International Joint Conference on Neural Networks","2021-July",,,"","",,,"10.1109/IJCNN52387.2021.9533307","https://www.scopus.com/inward/record.uri?eid=2-s2.0-85116451609&doi=10.1109%2fIJCNN52387.2021.9533307&partnerID=40&md5=580ec1ad2a38969cbcf506eeb7124289","Lobachevsky State University of Nizhny Novgorod, Department of Neurotechnology, Nizhny Novgorod, Russian Federation; Neuroscience and Cognitive Technology Lab, Innopolis University, Kazan, Russian Federation; Department of Radiophysical Methods in Medicine, Institute of Applied Physics of Ras, Nizhny Novgorod, Russian Federation; Institute of Information Technologies, Mathematics and Mechanics, Lobachevsky State University of Nizhny Novgorod, Nizhny Novgorod, Russian Federation; University College London, London, United Kingdom; University of Leicester, Leicester, United Kingdom","Tsybina, Y., Lobachevsky State University of Nizhny Novgorod, Department of Neurotechnology, Nizhny Novgorod, Russian Federation; Gordleeva, S., Lobachevsky State University of Nizhny Novgorod, Department of Neurotechnology, Nizhny Novgorod, Russian Federation, Neuroscience and Cognitive Technology Lab, Innopolis University, Kazan, Russian Federation; Krivonosov, M., Lobachevsky State University of Nizhny Novgorod, Department of Neurotechnology, Nizhny Novgorod, Russian Federation; Kastalskiy, I., Lobachevsky State University of Nizhny Novgorod, Department of Neurotechnology, Nizhny Novgorod, Russian Federation, Department of Radiophysical Methods in Medicine, Institute of Applied Physics of Ras, Nizhny Novgorod, Russian Federation; Zaikin, A., Institute of Information Technologies, Mathematics and Mechanics, Lobachevsky State University of Nizhny Novgorod, Nizhny Novgorod, Russian Federation, University College London, London, United Kingdom; Gorban, A., Lobachevsky State University of Nizhny Novgorod, Department of Neurotechnology, Nizhny Novgorod, Russian Federation, University of Leicester, Leicester, United Kingdom",Conference Paper,"Final","",Scopus,2-s2.0-85116451609
"Khafizov R., Savin S.","57282614900;55978984900;","Length-constrained mixed-integer convex programming-based generation of tensegrity structures",2021,"2021 6th IEEE International Conference on Advanced Robotics and Mechatronics, ICARM 2021",,,,"125","131",,1,"10.1109/ICARM52023.2021.9536138","https://www.scopus.com/inward/record.uri?eid=2-s2.0-85116262986&doi=10.1109%2fICARM52023.2021.9536138&partnerID=40&md5=e818951cfd07faac718be4f95a5351d7","The Institute of Robotics, Innopolis University, Innopolis, 420500, Russian Federation","Khafizov, R., The Institute of Robotics, Innopolis University, Innopolis, 420500, Russian Federation; Savin, S., The Institute of Robotics, Innopolis University, Innopolis, 420500, Russian Federation",Conference Paper,"Final","",Scopus,2-s2.0-85116262986
"Ortega R., Bobtsov A., Nikolaev N., Schiffer J., Dochain D.","7202793493;8046819200;13105019100;55605196900;7004923382;","Generalized parameter estimation-based observers: Application to power systems and chemical–biological reactors",2021,"Automatica","129",,"109635","","",,10,"10.1016/j.automatica.2021.109635","https://www.scopus.com/inward/record.uri?eid=2-s2.0-85104330214&doi=10.1016%2fj.automatica.2021.109635&partnerID=40&md5=ff50dccb7f9b6a9bc50f63648ceecd04","Departamento Académico de Sistemas Digitales, ITAM, Ciudad de México, Mexico; Department of Control Systems and Robotics, ITMO University, Kronverkskiy av. 49, Saint Petersburg197101, Russian Federation; Fachgebiet Regelungssysteme und Netzleitechnik, Brandenburgische Technische Universität Cottbus, Senftenberg, Germany; CESAME, Université Catholique de Louvain (UCL), Avenue Georges Lemaître, 4, Louvain-la-Neuve, B 1348, Belgium; Center for Technologies in Robotics and Mechatronics Components, Innopolis University, 1, Universitetskaya Str., Innopolis, Innopolis, 420500, Russian Federation","Ortega, R., Departamento Académico de Sistemas Digitales, ITAM, Ciudad de México, Mexico, Department of Control Systems and Robotics, ITMO University, Kronverkskiy av. 49, Saint Petersburg197101, Russian Federation; Bobtsov, A., Department of Control Systems and Robotics, ITMO University, Kronverkskiy av. 49, Saint Petersburg197101, Russian Federation, Center for Technologies in Robotics and Mechatronics Components, Innopolis University, 1, Universitetskaya Str., Innopolis, Innopolis, 420500, Russian Federation; Nikolaev, N., Department of Control Systems and Robotics, ITMO University, Kronverkskiy av. 49, Saint Petersburg197101, Russian Federation; Schiffer, J., Fachgebiet Regelungssysteme und Netzleitechnik, Brandenburgische Technische Universität Cottbus, Senftenberg, Germany; Dochain, D., CESAME, Université Catholique de Louvain (UCL), Avenue Georges Lemaître, 4, Louvain-la-Neuve, B 1348, Belgium",Article,"Final","All Open Access, Green",Scopus,2-s2.0-85104330214
