Authors,Author(s) ID,Title,Year,Source title,Volume,Issue,Art. No.,Page start,Page end,Page count,Cited by,DOI,Link,Affiliations,Authors with affiliations,Document Type,Publication Stage,Open Access,Source,EID
"Kotorov I., Krasylnykova Y., Zhdanov P., Mazzara M., Aslam H., Akhmetgaraeva E., Naumcheva M., Brown J.A.","57218595977;57218596308;57218597606;8557895400;57193924846;57422859200;57224577783;55724408300;","Institutional Commitment and Leadership as Prerequisites for Successful Comprehensive Internationalization",2021,"Communications in Computer and Information Science","1523 CCIS",,,"1","11",,,"10.1007/978-3-030-93135-3_1","https://www.scopus.com/inward/record.uri?eid=2-s2.0-85123273606&doi=10.1007%2f978-3-030-93135-3_1&partnerID=40&md5=333df2fc22e6a93a9094f5f4c2dfd98e","Karelia University of Applied Sciences, North Karelia, Joensuu, Finland; Innopolis University, Republic of Tatarstan, Innopolis, Russian Federation","Kotorov, I., Karelia University of Applied Sciences, North Karelia, Joensuu, Finland; Krasylnykova, Y., Karelia University of Applied Sciences, North Karelia, Joensuu, Finland; Zhdanov, P., Innopolis University, Republic of Tatarstan, Innopolis, Russian Federation; Mazzara, M., Innopolis University, Republic of Tatarstan, Innopolis, Russian Federation; Aslam, H., Innopolis University, Republic of Tatarstan, Innopolis, Russian Federation; Akhmetgaraeva, E., Innopolis University, Republic of Tatarstan, Innopolis, Russian Federation; Naumcheva, M., Innopolis University, Republic of Tatarstan, Innopolis, Russian Federation; Brown, J.A., Innopolis University, Republic of Tatarstan, Innopolis, Russian Federation",Conference Paper,"Final","All Open Access, Green",Scopus,2-s2.0-85123273606
"Shilintsev D., Dlamini G.","57219763307;57216151508;","A Study: Design Patterns Detection Approaches and Impact on Software Quality",2021,"Communications in Computer and Information Science","1523 CCIS",,,"84","96",,,"10.1007/978-3-030-93135-3_6","https://www.scopus.com/inward/record.uri?eid=2-s2.0-85123273151&doi=10.1007%2f978-3-030-93135-3_6&partnerID=40&md5=f983cbd41f1ee6a5576d8a0ddee0388e","Innopolis University, Innopolis, Russian Federation","Shilintsev, D., Innopolis University, Innopolis, Russian Federation; Dlamini, G., Innopolis University, Innopolis, Russian Federation",Conference Paper,"Final","",Scopus,2-s2.0-85123273151
"Sadovykh A., Truscan D., Bruneliere H.","24479058100;6508330976;27067480800;","Applying Model-based Requirements Engineering in Three Large European Collaborative Projects: An Experience Report",2021,"Proceedings of the IEEE International Conference on Requirements Engineering",,,,"367","377",,,"10.1109/RE51729.2021.00040","https://www.scopus.com/inward/record.uri?eid=2-s2.0-85123184131&doi=10.1109%2fRE51729.2021.00040&partnerID=40&md5=437650079e16564700be593b5dd359ad","Innopolis University, Innopolis, Russian Federation; SOFTEAM, Paris, France; Åbo Akademi University, Turku, Finland; IMT Atlantique, LS2N (UMR CNRS 6004), Nantes, France","Sadovykh, A., Innopolis University, Innopolis, Russian Federation, SOFTEAM, Paris, France; Truscan, D., Åbo Akademi University, Turku, Finland; Bruneliere, H., IMT Atlantique, LS2N (UMR CNRS 6004), Nantes, France",Conference Paper,"Final","All Open Access, Green",Scopus,2-s2.0-85123184131
"Stanko T., Sagirova E., Abramova M., Zhirosh O., Trapitsin S.","56115151200;57414672600;57414354000;56300888400;56698301200;","HOW DO WOMEN EXPERIENCE AN ALTERNATIVE EDUCATIONAL MODEL IN IT?",2021,"Proceedings - SEFI 49th Annual Conference: Blended Learning in Engineering Education: Challenging, Enlightening - and Lasting?",,,,"1247","1258",,,,"https://www.scopus.com/inward/record.uri?eid=2-s2.0-85122950371&partnerID=40&md5=c48bfdd4155d08b76765064bcee006e6","Saint-Petersburg State Univerity, Saint-Petersburg, Russian Federation; School 21, Kazan, Russian Federation; Tomsk State University, Tomsk, Russian Federation; Innopolis University, Kazan, Russian Federation; Herzen University, Saint-Petersburg, Russian Federation","Stanko, T., Saint-Petersburg State Univerity, Saint-Petersburg, Russian Federation; Sagirova, E., School 21, Kazan, Russian Federation; Abramova, M., Tomsk State University, Tomsk, Russian Federation; Zhirosh, O., Innopolis University, Kazan, Russian Federation; Trapitsin, S., Herzen University, Saint-Petersburg, Russian Federation",Conference Paper,"Final","",Scopus,2-s2.0-85122950371
"Lavazza A., Farina M.","24171318600;40661326300;","THE VIRTUES NEEDED BY EXPERTS IN ACTION [ДОБРОДЕТЕЛИ ДЛЯ ЭКСПЕРТОВ-В-ДЕЙСТВИИ]",2021,"Epistemology and Philosophy of Science","58","4",,"142","157",,1,"10.5840/EPS202158466","https://www.scopus.com/inward/record.uri?eid=2-s2.0-85122610838&doi=10.5840%2fEPS202158466&partnerID=40&md5=f04bd9612603ef3dec74f5c3a2608bb7","Centro Universitario Internazionale, Via Antonio Garbasso 42, AR, Arezzo, 52100, Italy; Institute for Humanities and Social Sciences, Innopolis University, 1 Universitetskaya St., Innopolis, 420500, Russian Federation","Lavazza, A., Centro Universitario Internazionale, Via Antonio Garbasso 42, AR, Arezzo, 52100, Italy; Farina, M., Institute for Humanities and Social Sciences, Innopolis University, 1 Universitetskaya St., Innopolis, 420500, Russian Federation",Article,"Final","",Scopus,2-s2.0-85122610838
"Karimov A.R.","56177724200;","THROUGH VIRTUES TO KNOWLEDGE: ON THE FOUNDATIONS OF ARETAIC APPROACH IN EPISTEMOLOGY [КЗНАНИЮ ЧЕРЕЗ ДОБРОДЕТЕЛИ: ОБ ОСНОВАНИЯХ АРЕТИЧЕСКОГО ПОДХОДА В ЭПИСТЕМОЛОГИИ]",2021,"Epistemology and Philosophy of Science","58","4",,"6","21",,,"10.5840/EPS202158455","https://www.scopus.com/inward/record.uri?eid=2-s2.0-85122577449&doi=10.5840%2fEPS202158455&partnerID=40&md5=676c7245b68aa38d991505bab400bffb","Kazan Federal University, 18 Kremlevskaya St., Kazan, 420008, Russian Federation; Innopolis University, 1 Universitetskaya St., Innopolis, 420500, Russian Federation","Karimov, A.R., Kazan Federal University, 18 Kremlevskaya St., Kazan, 420008, Russian Federation, Innopolis University, 1 Universitetskaya St., Innopolis, 420500, Russian Federation",Article,"Final","",Scopus,2-s2.0-85122577449
"Respall V.M., Devitt D., Fedorenko R., Klimchik A.","57205060820;57219857818;55692229600;37016245900;","Fast Sampling-based Next-Best-View Exploration Algorithm for a MAV",2021,"Proceedings - IEEE International Conference on Robotics and Automation","2021-May",,,"89","95",,3,"10.1109/ICRA48506.2021.9562107","https://www.scopus.com/inward/record.uri?eid=2-s2.0-85122154281&doi=10.1109%2fICRA48506.2021.9562107&partnerID=40&md5=724dbe6cf99408b4ce80dff11664e1b9","The Center for Technologies in Robotics and Mechatronics Components, Innopolis University, Russian Federation","Respall, V.M., The Center for Technologies in Robotics and Mechatronics Components, Innopolis University, Russian Federation; Devitt, D., The Center for Technologies in Robotics and Mechatronics Components, Innopolis University, Russian Federation; Fedorenko, R., The Center for Technologies in Robotics and Mechatronics Components, Innopolis University, Russian Federation; Klimchik, A., The Center for Technologies in Robotics and Mechatronics Components, Innopolis University, Russian Federation",Conference Paper,"Final","",Scopus,2-s2.0-85122154281
"Kiselev O.M.","57197254050;","Stochastic Properties of an Inverted Pendulum on a Wheel on a Soft Surface",2021,"Springer Proceedings in Complexity",,,,"361","373",,,"10.1007/978-3-030-70795-8_28","https://www.scopus.com/inward/record.uri?eid=2-s2.0-85122006091&doi=10.1007%2f978-3-030-70795-8_28&partnerID=40&md5=01eb969e60b3a951531fd6389d8915ce","Institute of Mathematics, ul. Chernyshevskogo 112, Ufa, 450008, Russian Federation; Innopolis University, ul. Universitetskaya 1, Innopolis, 420500, Russian Federation","Kiselev, O.M., Institute of Mathematics, ul. Chernyshevskogo 112, Ufa, 450008, Russian Federation, Innopolis University, ul. Universitetskaya 1, Innopolis, 420500, Russian Federation",Conference Paper,"Final","All Open Access, Green",Scopus,2-s2.0-85122006091
"Goodarzian F., Shishebori D., Bahrami F., Abraham A., Appolloni A.","57208797688;25928834300;55123689900;57218390610;55207164000;","Hybrid meta-heuristic algorithms for optimising a sustainable agricultural supply chain network considering CO2 emissions and water consumption",2021,"International Journal of Systems Science: Operations and Logistics",,,,"","",,,"10.1080/23302674.2021.2009932","https://www.scopus.com/inward/record.uri?eid=2-s2.0-85121662149&doi=10.1080%2f23302674.2021.2009932&partnerID=40&md5=ba9468c6748e9e503fbb415ed55cb009","Machine Intelligence Research Labs (MIR Labs), Scientific Network for Innovation and Research Excellence, Auburn, WA, United States; Department of Industrial Engineering, Yazd University, Yazd, Iran; Department of Industrial Management, Faculty of Law & Economics, Arak University, Arak, Iran; Center for Artificial Intelligence, Innopolis University, Innopolis, Russian Federation; Department of Management and Law, Faculty of Economics, University of Rome Tor Vergata, Rome, Italy; School of Management, Cranfield University, Bedford, United Kingdom","Goodarzian, F., Machine Intelligence Research Labs (MIR Labs), Scientific Network for Innovation and Research Excellence, Auburn, WA, United States; Shishebori, D., Department of Industrial Engineering, Yazd University, Yazd, Iran; Bahrami, F., Department of Industrial Management, Faculty of Law & Economics, Arak University, Arak, Iran; Abraham, A., Machine Intelligence Research Labs (MIR Labs), Scientific Network for Innovation and Research Excellence, Auburn, WA, United States, Center for Artificial Intelligence, Innopolis University, Innopolis, Russian Federation; Appolloni, A., Department of Management and Law, Faculty of Economics, University of Rome Tor Vergata, Rome, Italy, School of Management, Cranfield University, Bedford, United Kingdom",Article,"Article in Press","",Scopus,2-s2.0-85121662149
"Protasov S., Khan A.M.","57192671495;16679109100;","Using Proximity Graph Cut for Fast and Robust Instance-Based Classification in Large Datasets",2021,"Complexity","2021",,"2011738","","",,2,"10.1155/2021/2011738","https://www.scopus.com/inward/record.uri?eid=2-s2.0-85121615557&doi=10.1155%2f2021%2f2011738&partnerID=40&md5=1a3ce97ea230b44663f193433b3b1f6c","Machine Learning and Knowledge Representation Lab, Innopolis University, Innopolis, Innopolis, 420500, Russian Federation","Protasov, S., Machine Learning and Knowledge Representation Lab, Innopolis University, Innopolis, Innopolis, 420500, Russian Federation; Khan, A.M., Machine Learning and Knowledge Representation Lab, Innopolis University, Innopolis, Innopolis, 420500, Russian Federation",Article,"Final","All Open Access, Gold",Scopus,2-s2.0-85121615557
"Stanko T., Kuznetsov I., Zhirosh O., Lavrova S., Chernyskova E., Chernogortseva S.","56115151200;57198819784;56300888400;57211295457;57211288711;57211292453;","The development of the university via the development of the endowment",2021,"Proceedings of the European Conference on Innovation and Entrepreneurship, ECIE",,,,"972","976",,,"10.34190/EIE.21.033","https://www.scopus.com/inward/record.uri?eid=2-s2.0-85121586729&doi=10.34190%2fEIE.21.033&partnerID=40&md5=05a189f28d854d4f60333df30a7e8d82","Ural Federal University, Ekaterinburg, Russian Federation; Tambov State University, Russian Federation; Innopolis University, Kazan, Russian Federation; European University, Saint Petersburg, Russian Federation; University of Navarra, Pamplona, Spain; Higher School of Economics, Moscow, Russian Federation","Stanko, T., Ural Federal University, Ekaterinburg, Russian Federation; Kuznetsov, I., Tambov State University, Russian Federation; Zhirosh, O., Innopolis University, Kazan, Russian Federation; Lavrova, S., European University, Saint Petersburg, Russian Federation; Chernyskova, E., Ural Federal University, Ekaterinburg, Russian Federation, University of Navarra, Pamplona, Spain; Chernogortseva, S., Higher School of Economics, Moscow, Russian Federation",Conference Paper,"Final","",Scopus,2-s2.0-85121586729
"Vorobieva D.E., Petrenko A.S., Petrenko S.A.","57373555800;57200260915;57195327289;","Searching for the strong AI for cybersecurity",2021,"CEUR Workshop Proceedings","3035",,,"203","213",,,,"https://www.scopus.com/inward/record.uri?eid=2-s2.0-85121279213&partnerID=40&md5=0025ead39d216ead76485ad75e1c56d7","Saint-Petersburg Electrotechnical University «lETI», ul. Professora Popova, 5, St. Petersburg, 197022, Russian Federation; Innopolis University, Universitetskaya St, 1, Republic of Tatarstan, Innopolis, 420500, Russian Federation","Vorobieva, D.E., Saint-Petersburg Electrotechnical University «lETI», ul. Professora Popova, 5, St. Petersburg, 197022, Russian Federation; Petrenko, A.S., Saint-Petersburg Electrotechnical University «lETI», ul. Professora Popova, 5, St. Petersburg, 197022, Russian Federation; Petrenko, S.A., Saint-Petersburg Electrotechnical University «lETI», ul. Professora Popova, 5, St. Petersburg, 197022, Russian Federation, Innopolis University, Universitetskaya St, 1, Republic of Tatarstan, Innopolis, 420500, Russian Federation",Conference Paper,"Final","",Scopus,2-s2.0-85121279213
"Petrenko S.A., Vorobieva D.E., Petrenko A.S.","57195327289;57373555800;57200260915;","Secure software-defined storage",2021,"CEUR Workshop Proceedings","3035",,,"143","155",,,,"https://www.scopus.com/inward/record.uri?eid=2-s2.0-85121222777&partnerID=40&md5=53fb1ae5335f7fa3f687f1f7de6b8bae","Saint-Petersburg Electrotechnical University «lETI», ul. Professora Popova, 5, St. Petersburg, 197022, Russian Federation; Innopolis University, Universitetskaya St, 1, Republic of Tatarstan, Innopolis, 420500, Russian Federation","Petrenko, S.A., Saint-Petersburg Electrotechnical University «lETI», ul. Professora Popova, 5, St. Petersburg, 197022, Russian Federation, Innopolis University, Universitetskaya St, 1, Republic of Tatarstan, Innopolis, 420500, Russian Federation; Vorobieva, D.E., Saint-Petersburg Electrotechnical University «lETI», ul. Professora Popova, 5, St. Petersburg, 197022, Russian Federation; Petrenko, A.S., Saint-Petersburg Electrotechnical University «lETI», ul. Professora Popova, 5, St. Petersburg, 197022, Russian Federation",Conference Paper,"Final","",Scopus,2-s2.0-85121222777
"Jaimes-Reátegui R., Huerta-Cuellar G., García-López J.H., Pisarchik A.N.","8941071700;56002769300;57196778740;7005864666;","Multistability and noise-induced transitions in the model of bidirectionally coupled neurons with electrical synaptic plasticity",2021,"European Physical Journal: Special Topics",,,,"","",,1,"10.1140/epjs/s11734-021-00349-w","https://www.scopus.com/inward/record.uri?eid=2-s2.0-85120822347&doi=10.1140%2fepjs%2fs11734-021-00349-w&partnerID=40&md5=1d27c67b8b585e0b490f33d9643fc0e3","Departamento de Ciencias Exactas y Tecnología, Centro, Universitario de los Lagos, Universidad de Guadalajara, Enrique, Díaz de León 1144, Colonia Paseos de la Montaña, Lagos de Moreno, Jalisco, Mexico; Center for Biomedical Technology, Universidad Politécnica de Madrid, Campus Montegancedo, Pozuelo de Alarcón, Madrid  28223, Spain; Innopolis University, Universitetskaya Str. 1, Innopolis, 420500, Russian Federation","Jaimes-Reátegui, R., Departamento de Ciencias Exactas y Tecnología, Centro, Universitario de los Lagos, Universidad de Guadalajara, Enrique, Díaz de León 1144, Colonia Paseos de la Montaña, Lagos de Moreno, Jalisco, Mexico; Huerta-Cuellar, G., Departamento de Ciencias Exactas y Tecnología, Centro, Universitario de los Lagos, Universidad de Guadalajara, Enrique, Díaz de León 1144, Colonia Paseos de la Montaña, Lagos de Moreno, Jalisco, Mexico; García-López, J.H., Departamento de Ciencias Exactas y Tecnología, Centro, Universitario de los Lagos, Universidad de Guadalajara, Enrique, Díaz de León 1144, Colonia Paseos de la Montaña, Lagos de Moreno, Jalisco, Mexico; Pisarchik, A.N., Center for Biomedical Technology, Universidad Politécnica de Madrid, Campus Montegancedo, Pozuelo de Alarcón, Madrid  28223, Spain, Innopolis University, Universitetskaya Str. 1, Innopolis, 420500, Russian Federation",Article,"Article in Press","",Scopus,2-s2.0-85120822347
"Gafurov A.M., Usmanov B.M., Yermolayev O.P., Gubaidullin A.M., Khomyakov P.V., Gainullin I.I.","56912176600;56149074900;57354534000;57202923206;57191415716;56150512700;","The ""country of cities"" WEB-GIS: Development experience and approaches used in creating a history-oriented geoportal [КАРТОГРАФИЧЕСКИЙ ВЕБ-РЕСУРС ""СТРАНА ГОРОДОВ"": ОПЫТ РАЗРАБОТКИ И ИСПОЛЬЗУЕМЫЕ ПОДХОДЫ ПРИ СОЗДАНИИ ИСТОРИЧЕСКИ-ОРИЕНТИРОВАННОГО ГЕОПОРТАЛА]",2021,"InterCarto, InterGIS","27",,,"482","494",,,"10.35595/2414-9179-2021-4-27-482-494","https://www.scopus.com/inward/record.uri?eid=2-s2.0-85120608531&doi=10.35595%2f2414-9179-2021-4-27-482-494&partnerID=40&md5=801933742218d6f1e4f128e22ad1e809","Kazan Federal University, Institute of Ecology and Environmental Sciences, 5 Tovarishcheskaya St., Kazan, 420097, Russian Federation; Academy of Sciences of the Republic of Tatarstan, A.Kh. Khalikov Institute of Archaeology, 30 Butlerova St., Kazan, 420012, Russian Federation; Innopolis University, GIS Center, 1 Universitetskaya St., Innopolis, 420500, Russian Federation","Gafurov, A.M., Kazan Federal University, Institute of Ecology and Environmental Sciences, 5 Tovarishcheskaya St., Kazan, 420097, Russian Federation; Usmanov, B.M., Kazan Federal University, Institute of Ecology and Environmental Sciences, 5 Tovarishcheskaya St., Kazan, 420097, Russian Federation; Yermolayev, O.P., Kazan Federal University, Institute of Ecology and Environmental Sciences, 5 Tovarishcheskaya St., Kazan, 420097, Russian Federation; Gubaidullin, A.M., Academy of Sciences of the Republic of Tatarstan, A.Kh. Khalikov Institute of Archaeology, 30 Butlerova St., Kazan, 420012, Russian Federation; Khomyakov, P.V., Kazan Federal University, Institute of Ecology and Environmental Sciences, 5 Tovarishcheskaya St., Kazan, 420097, Russian Federation; Gainullin, I.I., Innopolis University, GIS Center, 1 Universitetskaya St., Innopolis, 420500, Russian Federation",Conference Paper,"Final","All Open Access, Gold",Scopus,2-s2.0-85120608531
"Hazarika R.A., Abraham A., Kandar D., Maji A.K.","57209214861;57218390610;8612278600;56126267200;","An Improved LeNet-Deep Neural Network Model for Alzheimer's Disease Classification Using Brain Magnetic Resonance Images",2021,"IEEE Access","9",,,"161194","161207",,,"10.1109/ACCESS.2021.3131741","https://www.scopus.com/inward/record.uri?eid=2-s2.0-85120551612&doi=10.1109%2fACCESS.2021.3131741&partnerID=40&md5=2c99b0f3c2e6eef86b73dfefbc6da87c","Department of Information Technology, North-Eastern Hill University, Meghalaya, Shillong, 793022, India; Machine Intelligence Research Labs, Auburn, WA  98071, United States; Center for Artificial Intelligence, Innopolis University, Innopolis, 420500, Russian Federation","Hazarika, R.A., Department of Information Technology, North-Eastern Hill University, Meghalaya, Shillong, 793022, India; Abraham, A., Machine Intelligence Research Labs, Auburn, WA  98071, United States, Center for Artificial Intelligence, Innopolis University, Innopolis, 420500, Russian Federation; Kandar, D., Department of Information Technology, North-Eastern Hill University, Meghalaya, Shillong, 793022, India; Maji, A.K., Department of Information Technology, North-Eastern Hill University, Meghalaya, Shillong, 793022, India",Article,"Final","All Open Access, Gold",Scopus,2-s2.0-85120551612
"Saitov K., Derczynski L.","57349434300;55668121600;","Abusive language recognition in Russian",2021,"Proceedings of the 8th BSNLP Workshop on Balto-Slavic Natural Language Processing, BSNLP 2021 - Co-located with the 16th European Chapter of the Association for Computational Linguistics, EACL 2021",,,,"20","25",,,,"https://www.scopus.com/inward/record.uri?eid=2-s2.0-85119578848&partnerID=40&md5=05be65372f168283a6a95ee5f081ab98","Innopolis University, Russian Federation; IT University of Copenhagen, Denmark","Saitov, K., Innopolis University, Russian Federation; Derczynski, L., IT University of Copenhagen, Denmark",Conference Paper,"Final","",Scopus,2-s2.0-85119578848
"Makhmutov M., Asapov T., Brown J.A.","57194571105;57347029800;55724408300;","Safety Risks in Location-Based Augmented Reality Games",2021,"Lecture Notes in Computer Science (including subseries Lecture Notes in Artificial Intelligence and Lecture Notes in Bioinformatics)","13056 LNCS",,,"457","464",,,"10.1007/978-3-030-89394-1_39","https://www.scopus.com/inward/record.uri?eid=2-s2.0-85119453678&doi=10.1007%2f978-3-030-89394-1_39&partnerID=40&md5=b5e8eb1ba9a0ea7205c9c9eaaa932bf2","Innopolis University, Innopolis, 420500, Russian Federation","Makhmutov, M., Innopolis University, Innopolis, 420500, Russian Federation; Asapov, T., Innopolis University, Innopolis, 420500, Russian Federation; Brown, J.A., Innopolis University, Innopolis, 420500, Russian Federation",Conference Paper,"Final","",Scopus,2-s2.0-85119453678
"Marouf R., Brown J.A.","57346365800;55724408300;","A Review on the Contribution of ClassDojo as Point System Gamification in Education",2021,"Lecture Notes in Computer Science (including subseries Lecture Notes in Artificial Intelligence and Lecture Notes in Bioinformatics)","13056 LNCS",,,"441","448",,,"10.1007/978-3-030-89394-1_37","https://www.scopus.com/inward/record.uri?eid=2-s2.0-85119449631&doi=10.1007%2f978-3-030-89394-1_37&partnerID=40&md5=14f2fd4779a9c6580d995f4157b7eb50","Innopolis University, Innopolis, 420500, Russian Federation","Marouf, R., Innopolis University, Innopolis, 420500, Russian Federation; Brown, J.A., Innopolis University, Innopolis, 420500, Russian Federation",Conference Paper,"Final","",Scopus,2-s2.0-85119449631
"Mikhel S.K., Klimchik A.S.","57203955171;37016245900;","Stiffness model reduction for manipulators with double encoders: Algebraic approach",2021,"Russian Journal of Nonlinear Dynamics","17","3",,"347","360",,,"10.20537/ND210308","https://www.scopus.com/inward/record.uri?eid=2-s2.0-85118613106&doi=10.20537%2fND210308&partnerID=40&md5=39eb97d092143901c1f791f856aba0ee","Innopolis University, ul. Universitetskaya 1, Innopolis, 420500, Russian Federation","Mikhel, S.K., Innopolis University, ul. Universitetskaya 1, Innopolis, 420500, Russian Federation; Klimchik, A.S., Innopolis University, ul. Universitetskaya 1, Innopolis, 420500, Russian Federation",Article,"Final","All Open Access, Gold",Scopus,2-s2.0-85118613106
"Kalinin Y.V., Marchuk E.A.","44161114000;57211562943;","Specifity of including of structural nonlinearity in model of dynamics of cable-driven robot [Особенности учета конструктивной нелинейности в модели динамики тросового робота]",2021,"Mekhatronika, Avtomatizatsiya, Upravlenie","22","10",,"547","552",,,"10.17587/mau.22.547-552","https://www.scopus.com/inward/record.uri?eid=2-s2.0-85118612127&doi=10.17587%2fmau.22.547-552&partnerID=40&md5=a3085467b8be235169eed47d669b3602","Innopolis University, Innopolis420500, Russian Federation; Volgograd State Technical University, Volgograd, 400005, Russian Federation; Department of Theoretical Mechanics, Volgograd State Technical University, Volgograd, 400005, Russian Federation","Kalinin, Y.V., Innopolis University, Innopolis420500, Russian Federation; Marchuk, E.A., Volgograd State Technical University, Volgograd, 400005, Russian Federation, Department of Theoretical Mechanics, Volgograd State Technical University, Volgograd, 400005, Russian Federation",Article,"Final","",Scopus,2-s2.0-85118612127
"Fadeev M., Boby R.A., Maloletov A.","57214681725;36069116200;35364441900;","Vision based method for improving position accuracy of four-cable-driven platform",2021,"2021 International Conference ""Nonlinearity, Information and Robotics"", NIR 2021",,,,"","",,2,"10.1109/NIR52917.2021.9666080","https://www.scopus.com/inward/record.uri?eid=2-s2.0-85118542206&doi=10.1109%2fNIR52917.2021.9666080&partnerID=40&md5=d7db2b747f1e4fa7d5d6561d6f311513","Innopolis University, Innopolis, Russian Federation","Fadeev, M., Innopolis University, Innopolis, Russian Federation; Boby, R.A., Innopolis University, Innopolis, Russian Federation; Maloletov, A., Innopolis University, Innopolis, Russian Federation",Conference Paper,"Final","",Scopus,2-s2.0-85118542206
"Almaghout K., Boby R.A., Othman M., Shaarawy A., Klimchik A.","57218479978;36069116200;57454639500;57216271542;37016245900;","Robotic Pick and Assembly Using Deep Learning and Hybrid Vision/Force Control",2021,"2021 International Conference ""Nonlinearity, Information and Robotics"", NIR 2021",,,,"","",,1,"10.1109/NIR52917.2021.9666138","https://www.scopus.com/inward/record.uri?eid=2-s2.0-85118530765&doi=10.1109%2fNIR52917.2021.9666138&partnerID=40&md5=71008f524a3c20f7007d62e04452bca1","Innopolis University, Innopolis, Russian Federation","Almaghout, K., Innopolis University, Innopolis, Russian Federation; Boby, R.A., Innopolis University, Innopolis, Russian Federation; Othman, M., Innopolis University, Innopolis, Russian Federation; Shaarawy, A., Innopolis University, Innopolis, Russian Federation; Klimchik, A., Innopolis University, Innopolis, Russian Federation",Conference Paper,"Final","",Scopus,2-s2.0-85118530765
